"pc_code_18","2018_IEC_district_code","pc_name_eng_18","pc_name_dari_18","assessment_status","planned_2018","2019_matched_to_2014_IEC_district_code","matched_by"
"0101002","0101","Derakht e Shing Mosque","مسجد درخت شنگ","New","YES","0101",NA
"0101012","0101","Sar e Karez Mosque","مسجد سر کاریز","Relocated","YES","0101",NA
"0101014","0101","Mahjooba High School","لیسه محجوبه","Relocated","YES","0101",NA
"0101015","0101","Takya Khanahh Jafarya","تکیه خانه جعفریه","Relocated","YES","0101",NA
"0101018","0101","Hazrat Nabawi Jame Mosque","مسجد جامع حضرت نبوی","Relocated","YES","0101",NA
"0101019","0101","Ansari High School","لیسه انصاری","Relocated","YES","0101",NA
"0101021","0101","Trade technical Institute (Institute Maslaki Teja)","انستیتیوت مسلکی تجارت","Relocated","YES","0101",NA
"0101025","0101","Imam Azam Mosque","مسجد امام اعظم","New","YES","0101",NA
"0101027","0101","Sa'ad bin Abi Waqas Mosque","مسجد سعد بن ابی وقاص","New","YES","0101",NA
"0101028","0101","Wazeer Mohammad Akbar Khan Secondary School","مکتب متوسطه وزير محمد اکبر خان","Old","YES","0101",NA
"0101029","0101","Naderia High School","ليسه نادريه","Old","YES","0101",NA
"0101033","0101","Sayed Jamaluddin Experimental Secondary School","مکتب متوسطه تجربوی سید جمال الدین","Old","YES","0101",NA
"0101034","0101","Afghan Technology Institute","انستیتوت تکنالوژی افغان","Old","YES","0101",NA
"0101035","0101","Sayed Jamaluddin Secondary School","مکتب متوسطه سید جمال الدین","Old","YES","0101",NA
"0101036","0101","Raabia Balkhi High School","لیسه رابعه بلخی","Old","YES","0101",NA
"0101042","0101","Jamal Mena, no. 12 Preliminary School","مکتب ابتدایه نمبر 12 جمال مینه","Old","YES","0101",NA
"0101044","0101","Durkhanai High School","لیسه درخانی","Relocated","YES","0101",NA
"0101046","0101","Sufi Islam School","مکتب صوفی اسلام","Old","YES","0101",NA
"0101047","0101","Mahmood Hotaki High School","لیسه محمود هوتکی","Old","YES","0101",NA
"0101052","0101","Mohammad Alam Faizzad High School","لیسه محمد اعلم فیض زاد","Old","YES","0101",NA
"0101053","0101","Jamhoriat High School","لیسه جمهویت","Old","YES","0101",NA
"0101054","0101","Malalai Girls High School","لیسه نسوان ملالی","Old","YES","0101",NA
"0101059","0101","Ismaelia Jamat Khana","جماعت خانه اسماعيليه","Old","YES","0101",NA
"0101060","0101","Ustad Misbah High School","لیسه استاد مصباح","Old","YES","0101",NA
"0101066","0101","Shuhadai Fazel Baig Mosque","مسجد شهدای فاضل بیک","New","YES","0101",NA
"0101074","0101","Wardaki ha Mosque","مسجد وردکيها","Old","YES","0101",NA
"0101087","0101","Hazrat Mohammad (pbuh) Mosque","مسجد حضرت محمد ص","Relocated","YES","0101",NA
"0101105","0101","Wali Aser Jame Mosque","مسجد جامع ولی عصر","Relocated","YES","0101",NA
"0101116","0101","Safiullah Afzali High School","لیسه صفی الله افضلی","New","YES","0101",NA
"0101119","0101","Qalla e Fatoh Ahmadia Mosque","مسجد احمدیه قلعه فتوح","Old","YES","0101",NA
"0101132","0101","Guzargah Girls Secondary School","مکتب متوسطه نسوان گذرگاه","Old","YES","0101",NA
"0101134","0101","Habibia Girls High School","لیسه حبیبیه","Old","YES","0101",NA
"0101137","0101","Mohammadia Mosque","مسجد محمدیه","Relocated","YES","0101",NA
"0101143","0101","Hazrat Bilal Mosque","مسجد حضرت بلال","New","YES","0101",NA
"0101146","0101","Hazarat Bilal Mosque","مسجد حضرت بلال","Relocated","YES","0101",NA
"0101163","0101","Shaheed Abdul Sabour Fareed School","مکتب شهید عبدالصبورفرید","Relocated","YES","0101",NA
"0101170","0101","Qalla e Hashmat Khan Secondary School","متوسطه قلعه حشمت خان","Relocated","YES","0101",NA
"0101171","0101","Ilhaqya no.1 Abdul Hai Habibi High School","الحاقیه نمبر یک لیسه عبدالحی حبی","Relocated","YES","0101",NA
"0101172","0101","Noor Mohammad Mosque","مسجد نور محمد","Old","YES","0101",NA
"0101180","0101","Shaheed Sardar Mohammad Daud Khan Mosque","شهید سردار محمد داود خان","Relocated","YES","0101",NA
"0101181","0101","IT and Telecommunications Institute","انستیتوت تکنالوژی معلوماتی و مخا","Old","YES","0101",NA
"0101192","0101","Amani High School","لیسه عالی امانی","Old","YES","0101",NA
"0101198","0101","Aziz Afghan Secondary School","مکتب متوسطه عزيز افغان","Old","YES","0101",NA
"0101201","0101","Shahrak Jame Mosque","مسجد جامع شهرک","New","YES","0101",NA
"0101202","0101","Hazrat Omer Farouq Old Mosque","مسجد اسبق حضرت عمر فاروق","Old","YES","0101",NA
"0101210","0101","Omer Farooq Mosque","مسجد عمرفاروق","Old","YES","0101",NA
"0101225","0101","Sayedul Naseri Boys High School","لیسه ذکور سیدالناصری","Relocated","YES","0101",NA
"0101227","0101","Khairkhana Cinema","سینما خیرخانه","Old","YES","0101",NA
"0101232","0101","Zulaikha High School","لیسه ذلیخا","Relocated","YES","0101",NA
"0101235","0101","Ashab e Kahaf Mosque","مسجد اصحاب کهف","New","YES","0101",NA
"0101241","0101","Quba Mosque","مسجد قبا","Relocated","YES","0101",NA
"0101242","0101","Abu Huraira Mosque","مسجد ابو هریره","Old","YES","0101",NA
"0101244","0101","Fateha Khana e Zanana","فاتحه خانه زنانه","Old","YES","0101",NA
"0101246","0101","Anas Bin e Malik Mosque","مسجد انس بن مالک","Relocated","YES","0101",NA
"0101248","0101","Bibi Sarwari Sangari High School","لسیه بی بی سروری سنگری","Old","YES","0101",NA
"0101250","0101","Abdul Raouf Benawa High School","لیسه عالی عبدالروف بینوا","New","YES","0101",NA
"0101252","0101","Abdul Qayoum Wardak High School","لیسه عبدالقیوم وردک","Relocated","YES","0101",NA
"0101255","0101","Qalla e Jabar Khan Secondary School","مکتب متوسطه قلعه جبارخان","New","YES","0101",NA
"0101256","0101","Mohammad Akbar Khan Pamir Girls High School","لیسه نسوان محمد اکبر خان پامیر","New","YES","0101",NA
"0101262","0101","Nawabad (Zan Abad) Secondary School","متوسطه نوآباد (زن آباد)","Relocated","YES","0101",NA
"0101263","0101","Shahrak Mahdia High School","لیسه شهرک مهدیه","Relocated","YES","0101",NA
"0101267","0101","Zainab Kubra Girls High School","لیسه نسوان زینب کبرا","Relocated","YES","0101",NA
"0101276","0101","Imam Khumaini Mosque","مسجد امام خمینی","Old","YES","0101",NA
"0101281","0101","Nawabad Doghabad High School","لیسه نو آباد دوغ آباد","Relocated","YES","0101",NA
"0101284","0101","Shahrak e Safa Boys High School","لیسه ذکور شهرک صفا","Relocated","YES","0101",NA
"0101303","0101","Hazrat Hamza Mosque","مسجد حضرت حمزه","Relocated","YES","0101",NA
"0101304","0101","Shiekh Zahid High School","لیسه شیخ زاهد","Relocated","YES","0101",NA
"0101337","0101","Alokhil Secondary School","مکتب متوسطه آلوخیل","Old","YES","0101",NA
"0101345","0101","Lamia Shaheed High School","لیسه لامعه شهید","Old","YES","0101",NA
"0101347","0101","Nawabad Newly established Primary School","مکتب ابتدائیه جدیدالتاسیس نو آباد","Old","YES","0101",NA
"0101348","0101","Qari Nek Mohammad High School","لیسه قاری نیک محمد","Old","YES","0101",NA
"0101350","0101","Shahrak Zakereen High School","لیسه شهرک ذاکرین","New","YES","0101",NA
"0101352","0101","Pamir Girls High School","لیسه نسوان پامیر","New","YES","0101",NA
"0101354","0101","AbuBakar Sedique Jame Mosque","مسجد جامع ابوبکر صدیق","New","YES","0101",NA
"0101355","0101","Shahrak Wahdat Girls High School","لیسه نسوان شهرک وحدت","New","YES","0101",NA
"0101356","0101","Burhanuddin Rabani High School","لیسه برهان الدین ربانی","Relocated","YES","0101",NA
"0101357","0101","Hazrat Ali Jame Mosque","مسجدجامع حضرت علی","New","YES","0101",NA
"0101358","0101","Wazeer Gul Mosque","مسجد وزیر ګل","Old","YES","0101",NA
"0101359","0101","Nawabad Primary School","ابتدایه نواباد","New","YES","0101",NA
"0101362","0101","Sulh High School","لیسه صلح","Old","YES","0101",NA
"0101364","0101","Haji Zafran Secondary School","حاجی زعفران منحنی شوونحی","Relocated","YES","0101",NA
"0101365","0101","Haji Sardar Mosque","مسجد حاجی سردار","New","YES","0101",NA
"0101370","0101","75 Beds Hospital","شفاخانه 75 بستر","New","YES","0101",NA
"0101371","0101","Ahmad Jan Mosque","مسجد احمد جان","Old","YES","0101",NA
"0101374","0101","Janat Gul Primary School No. 1","ابتدائیه نمبر اول جنت گل","Relocated","YES","0101",NA
"0101554","0101","Shahrak Arya School","مکتب شهرک آریا",NA,"YES","0101",NA
"0101555","0101","Emam Abo Hanifa Mosque","مسجد جامع امام ابوحنیفه",NA,"YES","0101",NA
"0101556","0101","Safid Mosque","مسجد سفید",NA,"YES","0101",NA
"0101559","0101","Nahia Office","دف یي ناحیه",NA,"YES","0101",NA
"0102298","0102","Qalla e Babu Training Center","مرکز آموزشی قلعه بابو","Relocated","YES","0102",NA
"0102299","0102","Ibrahim Khil High School","لیسه ابراهیم خیل","Relocated","YES","0102",NA
"0102378","0102","Al Taqwa High School","لیسه التقوا","Relocated","YES","0102",NA
"0102380","0102","Pashayee Boys High School","لیسه ذکور پشه ئی","Relocated","YES","0102",NA
"0102383","0102","Murghgeeran clinic","کلینیک مرغگیران","Relocated","YES","0102",NA
"0102387","0102","Sufi Ashqari High School","لیسه صوفی عشقری","New","YES","0102",NA
"0102394","0102","Alfalah Secondary School","متوسطه الفلاح","New","YES","0102",NA
"0102395","0102","Qalla e Malik High School","لیسه قلعه ملک","Relocated","YES","0102",NA
"0103399","0103","Nawniaz Girls Primary School","مکتب ابتدائیه نسوان نو نیاز","Relocated","YES","0103",NA
"0103405","0103","Khairabad Jame Mosque","مسجد جامع خیرآباد","Old","YES","0103",NA
"0103411","0103","Lalandar clinic","کلینیک للندر","Relocated","YES","0103",NA
"0104413","0104","Wyearr Ahmadzai High School","لیسه ویار احمدزی","Relocated","YES","0104",NA
"0104414","0104","Imam Abu Haneefa Mosque","مسجد امام ابو حنیفه","Relocated","YES","0104",NA
"0104420","0104","Qalla e Noman High School","لیسه قلعه نعمان","New","YES","0104",NA
"0104557","0104","Hazrat Belal White Mosque","م س ج د س ف ی د ح یصر ت ب لا ل",NA,"YES","0104",NA
"0104558","0104","Shahid Shamali School","مکتب شهید شمالی",NA,"YES","0104",NA
"0105429","0105","Kakarr Jame Mosque","مسجد جامع کاکړ","New","YES","0105",NA
"0105432","0105","Khwaja Ghar Secondary School","متوسطه خواجه غار","New","YES","0105",NA
"0105434","0105","Baba Qashqar vocational School","مکتب حرفوی بابه قشقار","Relocated","YES","0105",NA
"0105435","0105","Aabdara High School","لیسه آبدره","New","YES","0105",NA
"0105437","0105","Shiekh Saduddin Mohammad Ansari Secondary School","متوسطه شیخ سعدالدین محمد انصاری","New","YES","0105",NA
"0105443","0105","Pul e Sangi Health Clinic","کلینک صحی پل سنکی","New","YES","0105",NA
"0106445","0106","Kochi Secondary School","مکتب متوسط کوچی","Relocated","YES","0106",NA
"0107459","0107","Shenkai Dashtak Village Jame Mosque","مسجد جامع قریه شینکی دشتک","Old","YES","0107",NA
"0107462","0107","Sang e Naweshta Mosque","مسجد سنگ  نوشته","New","YES","0107",NA
"0107463","0107","Qalla E Janan Girls Secondary School","مکتب متوسطه نسوان قلعه جانان","Relocated","YES","0107",NA
"0107464","0107","Rahmat Abad Secondary School","مکتب متوسطه رحمت آباد","New","YES","0107",NA
"0107465","0107","Mosahi Ulya High School","لیسه موسهی علیا","Old","YES","0107",NA
"0107466","0107","Miakhil Clinic","کلینیک میاخیل","Relocated","YES","0107",NA
"0108471","0108","Hawashinasi (Meteorology)","هواشناسی","Relocated","YES","0108",NA
"0108472","0108","Qalam Chaq Primary School","مکتب ابتدایه قلم چاق","Relocated","YES","0108",NA
"0109485","0109","Mullah Omer Primary School","مکتب ابتدائیه ملاعمر","New","YES","0109",NA
"0110493","0110","Karendah High School","لیسه کارنده","Relocated","YES","0110",NA
"0110494","0110","Mashwanni Secondary School","مکتب متوسطه مشوانی","Relocated","YES","0110",NA
"0110560","0110","Mir Darwish Kohdamani High School","ل ی س ه م ر ي د ر و ی ش ک و ه د ا م ین",NA,"YES","0110",NA
"0111495","0111","Dasht e Guldarah High School","لیسه دشت گلدره","Relocated","YES","0111",NA
"0111500","0111","Khurasan School","مکتب خراسان","Relocated","YES","0111",NA
"0112505","0112","Qalla e Mir Afghan School","مکتب قلعه میرا فغان","Relocated","YES","0112",NA
"0112507","0112","Jame Mosque","مسجد جامع","Relocated","YES","0112",NA
"0115537","0115","Sarchashma Girls Secondary School","متوسطه نسوان سرچشمه","Relocated","YES","0115",NA
"0115544","0115","Mia Rasoul Baba Mosque","مسجد میارسول بابا","New","YES","0115",NA
"0115549","0115","Gaz Ulya School","مکتب گاز علیا","Old","YES","0115",NA
"0115550","0115","Yakhdand School","مکتب یخدند","New","YES","0115",NA
"0115551","0115","Husain Khil High School","لیسه حسین خیل","New","YES","0115",NA
"0201004","0201","Zakozai Mosque","مسجد جامع زکوزائی","New","YES","0201",NA
"0201005","0201","Late Sayed Mir Jan Mosque","مسجدمرحوم سید میرجان","New","YES","0201",NA
"0201011","0201","Qari Mir Usman Shaheed Girls High School","لیسه نسوان قاری میرعثمان شهید","Relocated","YES","0201",NA
"0201013","0201","Qazi Khil Girls High School","لیسه نسوان قاضی خیل","New","YES","0201",NA
"0201016","0201","Malik Gee Khil Mosque","مسجد ملک جی خیل","New","YES","0201",NA
"0202017","0202","Alhaj Ghulam Sakhi Girls Secondary School","مکتب متوسطه نسوان الحاج غلام سخی","Relocated","YES","0202",NA
"0202018","0202","Haji Mohammad Hakim Shaheed Secondary School","مکتب متوسطه حاجی محمد حکیم شهید","New","YES","0202",NA
"0202020","0202","Mohammad Anwar Shaheed Primary School","لیسه ذکور محمد انور شهید","Relocated","YES","0202",NA
"0202094","0202","Mullah Muhammad Shahid School","مکتب ملامحمد شهید",NA,"YES","0202",NA
"0203026","0203","Qalla e Atta Khan Girls Primary School","مکتب ابتدایه نسوان قلعه عطلخان","New","YES","0203",NA
"0203028","0203","Habib Khil Mosque","مسجد حبیب خیل","Old","YES","0203",NA
"0204034","0204","Ilhaqya Qalla e Mir School","مکتب الحاقیه قلعه میر","New","YES","0204",NA
"0204035","0204","Abdul Shukoor Khan Secondary School","مکتب متوسطه عبدالشکورخان","Relocated","YES","0204",NA
"0204039","0204","Naser Khan Khil Secondary School","مکتب متوسطه ناصرخانخیل","New","YES","0204",NA
"0205048","0205","Kahloot Secondary School","مکتب متوسطه کهلوت","New","YES","0205",NA
"0205050","0205","Qalla e Ghani Girls School","مکتب نسوان قلعه غنی","Relocated","YES","0205",NA
"0205060","0205","Sabat Mosque","مسجد سابات","Relocated","YES","0205",NA
"0205062","0205","Bagh e Aman Mosque","مسجد باغ امان","Old","YES","0205",NA
"0205065","0205","Weeshar Mosque","مسجد ویشار","Old","YES","0205",NA
"0205068","0205","Abdul Salam Shaheed Primary School","مکتب  ابتدائیه عبدالسلام شهید","Old","NO","0205",NA
"0206074","0206","Tatar Khil Mosque","مسجد تتر خیل","Old","NO","0206",NA
"0206075","0206","Ghazi Amanullah High School","لیسه غازی امان الله","Not Assessed","NO","0206",NA
"0206076","0206","Shaheed Hafeezullah Secondary School","متوسطه شهید حفیظ الله","Old","YES","0206",NA
"0206078","0206","Aman Shaheed Primary School","مکتب ابتدائیه امان شهید","Old","NO","0206",NA
"0206079","0206","Rod Khushk Mosque","مسجد رود خشک","Old","NO","0206",NA
"0206080","0206","Sofyan Mosque","مسجد صوفیان","Not Assessed","NO","0206",NA
"0206081","0206","Shaheed Anwar Khil High School","لیسه شهید انور خیل","Not Assessed","NO","0206",NA
"0206082","0206","Chayee Khil Primary School","مکتب ابتدائیه چایی خیل","Old","NO","0206",NA
"0206083","0206","Nowrozkhil Jame Mosque","مسجد جامع نوروز خیل","Old","NO","0206",NA
"0206084","0206","Shalwati Mosque","مسجد شلواتی","Not Assessed","YES","0206",NA
"0206085","0206","Payenda Khil School","مکتب پاینده خیل","Old","YES","0206",NA
"0207087","0207","Sultan Khil Mosque","مسجد سلطانخیل","Not Assessed","YES","0207",NA
"0207088","0207","Hayatullah Shaheed High School","لیسه حیات الله شهید","Old","YES","0207",NA
"0207089","0207","Hassan Shaheed Primary School","مکتب ابتدائیه حسن شهید","Not Assessed","YES","0207",NA
"0207090","0207","Chayee Khil Primary School","مکتب ابتدائیه چایی خیل","Old","NO","0207",NA
"0207091","0207","Kondi High School","لسیه کوندی","Old","NO","0207",NA
"0207092","0207","Hassan Abad Primary School","مکتب ابتدائیه حسن آباد","Not Assessed","NO","0207",NA
"0207093","0207","Koti Primary School","مکتب ابتدائیه  کوتی","Not Assessed","NO","0207",NA
"0301004","0301","Bibi Safia Jame Mosque","مسجد جامع بی بی صفیه","New","YES","0301",NA
"0301005","0301","Omer Farouq Jame Mosque","مسجد جامع عمر فاروق","Relocated","YES","0301",NA
"0301006","0301","Parcha 13 Shahri School","مکتب پارچه ۱۳ شهری","New","YES","0301",NA
"0301013","0301","Abdul Qudous Jame Mosque","مسجد حاجی عبدالقدوس","New","YES","0301",NA
"0301015","0301","Pashayan Girls School","مکتب نسوان پشیان","Relocated","YES","0301",NA
"0301017","0301","Bayan Payen Secondary School","مکتب متوسه بایان پائین","Relocated","YES","0301",NA
"0301018","0301","Dolana High School","لیسه دولانه","Relocated","YES","0301",NA
"0301019","0301","Ilhaqya Khadijatul Kubra Madrassah","مدرسه الحاقیه خدیجه الکبرا","Relocated","YES","0301",NA
"0301021","0301","Amanullah Shaheed High School","لیسه امان الله شهید","Relocated","YES","0301",NA
"0301024","0301","Toghbeerdee Boys High School","لیسه ذکور توغبیردی","Relocated","YES","0301",NA
"0301031","0301","Shaheed Mawlawi Abdul Rahim Hanafi Darul Uloom","دارالعلوم شهید مولوی عبدالرحیم حنفی","New","YES","0301",NA
"0301036","0301","Mullah Hakam Shaheed High School","لیسه ملا حکم شهید","Relocated","YES","0301",NA
"0302040","0302","Nikah Khil Madrassah","مدرسه نکاح خیل","Relocated","YES","0302",NA
"0302041","0302","Khanqa Girls Secondary School","مکتب متوسطه نسوان  خانقا","New","YES","0302",NA
"0302047","0302","Bagram Airport Girls High School","لیسه نسوان میدان  هوای بگرام","Relocated","YES","0302",NA
"0302049","0302","Ghulam Ali Girls Secondary School","مکتب متوسطه نسوان غلام علی","Relocated","YES","0302",NA
"0303061","0303","Ustamah High School","لیسه استامه","Not Assessed","NO","0303",NA
"0303063","0303","Abdul Karim Shaheed School","مکتب عبداکریم شهید","Not Assessed","NO","0303",NA
"0303064","0303","Ezatullah Qul Har School","مکتب عزت الا قول هر","Not Assessed","NO","0303",NA
"0303065","0303","Mohammad Sharif Kafshan High School","لیسه  محمد شر یف  کفشان","Not Assessed","NO","0303",NA
"0303069","0303","Mawlawi Yar Mohammad Madrassah","مدرسه مولوی یارمحمد","Relocated","YES","0303",NA
"0303070","0303","Daraz Gerd School","مکتب دراز گرد","Relocated","YES","0303",NA
"0303172","0303","Namakab Secondary School","مکتب متوسطه نمک آب",NA,"YES","0303",NA
"0304072","0304","Abu Hanifah Ancho High School","مکتب لیسه ابوحنیفه انچو","Relocated","YES","0304",NA
"0304076","0304","Sayed Khil Girls High School","لیسه نسوان سیدخیل","New","YES","0304",NA
"0304078","0304","Gul Aqa Shaheed High School","مکتب لیسه گل آقا شهید","New","YES","0304",NA
"0304083","0304","Ma'azuddin Khil Clinic","کلینیک معازالدین خیل","New","YES","0304",NA
"0304085","0304","Lalah Khil Secondary School","مکتب متوسطه لاله خیل","New","YES","0304",NA
"0305087","0305","Mawlana Jalaluddin Mohammad Balkhi Girls Primary *","مکتب ابتدائیه نسوان مولانا جلال الدین محمد بلخی","New","YES","0305",NA
"0305089","0305","Faqeer Haider Gulbahar High School","لیسه فقیر حیدر گلبهار","Relocated","YES","0305",NA
"0305091","0305","Nawya Mosque","مسجد ناویا","New","YES","0305",NA
"0305093","0305","Gulbahar Darul Hefaz","دارالحفاظ گلبهار","Relocated","YES","0305",NA
"0305095","0305","Ishq Abad Girls High School","لیسه  نسوان عشق آباد","Relocated","YES","0305",NA
"0305096","0305","Guzar e Payan Girls High School","لیسه نسوان گزر پایان","New","YES","0305",NA
"0305098","0305","Habib Khil Mosque","مسجد حبیب خیل","Relocated","YES","0305",NA
"0306104","0306","Eng. Mohammad Gul Shaheed Secondary School","مکتب متوسطه انجینر محمد گل شهید","Old","YES","0306",NA
"0306106","0306","Haji Abdul Karim Secondary School","مکتب متوسطه حاجی عبدالحکیم","Old","YES","0306",NA
"0306107","0306","Takhma High School","لیسه تاخمه","Old","YES","0306",NA
"0306109","0306","Hunroh e Bala Secondary School","متوسط هنروه بالا","New","YES","0306",NA
"0306110","0306","Ghulam Nabi Shaheed High School","لیسه غلام نبی شهید","Relocated","YES","0306",NA
"0306111","0306","Wewa Secondary School","مکتب متوسطه ویوا","Old","YES","0306",NA
"0306112","0306","Do Aab High School","لیسه دوآب","New","YES","0306",NA
"0306114","0306","Aahangaran High School","لیسه آهنگران","Old","YES","0306",NA
"0306115","0306","Salah Khan Secondary School","مکتب متوسطه صلاح خان","New","YES","0306",NA
"0306116","0306","Awrti High School","لیسه اورتی","New","YES","0306",NA
"0307117","0307","Sar Darah Secondary School","مکتب متوسطه سردره","Not Assessed","NO","0307",NA
"0307120","0307","Wazghar School","مکتب وازغر","Not Assessed","NO","0307",NA
"0307121","0307","Darah e Tank e Malakhi Secondary School","مکتب متوسطه دره تانک ملاخی","Not Assessed","NO","0307",NA
"0307122","0307","Qamchaq High School","لیسه قمچاق","Not Assessed","NO","0307",NA
"0307123","0307","Dashtak Rangaab School","مکتب دشتک رنگاب","Not Assessed","NO","0307",NA
"0307124","0307","Joi Dukhtar School","مکتب جوی دختر","Not Assessed","NO","0307",NA
"0307125","0307","Darah e Sayadan High School","لیسه دره سیادان","Not Assessed","NO","0307",NA
"0307128","0307","Makar Khil Girls School","مکتب نسوان مکرخیل","Not Assessed","NO","0307",NA
"0307130","0307","Tahi Khan School","مکتب تاهی خان","Not Assessed","NO","0307",NA
"0307131","0307","Yakh Darah School","مکتب یخ دره","Not Assessed","NO","0307",NA
"0307132","0307","Kana Khil School","مکتب کانه خیل","Not Assessed","NO","0307",NA
"0307133","0307","Shahi Khil School","مکتب شاهی خیل","Not Assessed","NO","0307",NA
"0307171","0307","Siagerd Female High School","لیسه اناث سیاه گرد",NA,"YES","0307",NA
"0308134","0308","Kandwan School","مکتب کندوان","Not Assessed","NO","0308",NA
"0308135","0308","Angor Darah School","مکتب انگور دره","Relocated","YES","0308",NA
"0308137","0308","Syah Sang Secondary School","مکتب متوسطه سیاه سنگ","Relocated","YES","0308",NA
"0308138","0308","Iskandariah Boys High School","لیسه ذکور اسکندریه","New","YES","0308",NA
"0308140","0308","Treli Girls School","نسوان تریلی","New","YES","0308",NA
"0308144","0308","Jawzak Mosque","مکتب جوزک","Not Assessed","NO","0308",NA
"0309148","0309","Shaheed Amirzadah Madrassah","مدرسه شهید امیرزاده","New","YES","0309",NA
"0309149","0309","Khwaja Parsa School","مکتب خواجه پارساه","Relocated","YES","0309",NA
"0309150","0309","Lawlanj Bazzar Girls High School","لیسه نسوان بازار لولنج","Old","YES","0309",NA
"0309152","0309","Payurki School","مکتب پایورکی","New","YES","0309",NA
"0309158","0309","Dahan e Khakrez Boys High School","لیسه ذکور دهن خاکریز","Old","YES","0309",NA
"0310162","0310","Ali Akbar Shaheed High School","لیسه عالی اکبر شهید","Old","YES","0310",NA
"0310164","0310","Mir Khushal Wali Jame Mosque","مسجد جامع میر خوشحال ولی","New","YES","0310",NA
"0310167","0310","Darah e Jarf Girls Secondary School","مکتب متوسطه نسوان دره جرف","New","YES","0310",NA
